DOI,Title,Authors,Abstract,Section,Date
2503.16550,Unified Enhancement of the Generalization and Robustness of Language Models via Bi-Stage Optimization,"Yudao Sun, Juan Yin, Juan Zhao, Fan Zhang, Yongheng Liu, Hongji Chen","Neural network language models (LMs) are confronted with significant challenges in generalization and robustness. Currently, many studies focus on improving either generalization or robustness in isolation, without methods addressing both aspects simultaneously, which presents a significant challenge in developing LMs that are both robust and generalized. In this paper, we propose a bi-stage optimization framework to uniformly enhance both the generalization and robustness of LMs, termed UEGR. Specifically, during the forward propagation stage, we enrich the output probability distributions of adversarial samples by adaptive dropout to generate diverse sub models, and incorporate JS divergence and adversarial losses of these output distributions to reinforce output stability. During backward propagation stage, we compute parameter saliency scores and selectively update only the most critical parameters to minimize unnecessary deviations and consolidate the model's resilience. Theoretical analysis shows that our framework includes gradient regularization to limit the model's sensitivity to input perturbations and selective parameter updates to flatten the loss landscape, thus improving both generalization and robustness. The experimental results show that our method significantly improves the generalization and robustness of LMs compared to other existing methods across 13 publicly available language datasets, achieving state-of-the-art (SOTA) performance.",cs.CL,19/03/2025
2503.16544,Causal Discovery and Counterfactual Reasoning to Optimize Persuasive Dialogue Policies,"Donghuo Zeng, Roberto Legaspi, Yuewen Sun, Xinshuai Dong, Kazushi Ikeda, Peter Spirtes, Kun Zhang","Tailoring persuasive conversations to users leads to more effective persuasion. However, existing dialogue systems often struggle to adapt to dynamically evolving user states. This paper presents a novel method that leverages causal discovery and counterfactual reasoning for optimizing system persuasion capability and outcomes. We employ the Greedy Relaxation of the Sparsest Permutation (GRaSP) algorithm to identify causal relationships between user and system utterance strategies, treating user strategies as states and system strategies as actions. GRaSP identifies user strategies as causal factors influencing system responses, which inform Bidirectional Conditional Generative Adversarial Networks (BiCoGAN) in generating counterfactual utterances for the system. Subsequently, we use the Dueling Double Deep Q-Network (D3QN) model to utilize counterfactual data to determine the best policy for selecting system utterances. Our experiments with the PersuasionForGood dataset show measurable improvements in persuasion outcomes using our approach over baseline methods. The observed increase in cumulative rewards and Q-values highlights the effectiveness of causal discovery in enhancing counterfactual reasoning and optimizing reinforcement learning policies for online dialogue systems.",cs.CL,19/03/2025
2503.16541,Poly-FEVER: A Multilingual Fact Verification Benchmark for Hallucination Detection in Large Language Models,"Hanzhi Zhang, Sumera Anjum, Heng Fan, Weijian Zheng, Yan Huang, Yunhe Feng","Hallucinations in generative AI, particularly in Large Language Models (LLMs), pose a significant challenge to the reliability of multilingual applications. Existing benchmarks for hallucination detection focus primarily on English and a few widely spoken languages, lacking the breadth to assess inconsistencies in model performance across diverse linguistic contexts. To address this gap, we introduce Poly-FEVER, a large-scale multilingual fact verification benchmark specifically designed for evaluating hallucination detection in LLMs. Poly-FEVER comprises 77,973 labeled factual claims spanning 11 languages, sourced from FEVER, Climate-FEVER, and SciFact. It provides the first large-scale dataset tailored for analyzing hallucination patterns across languages, enabling systematic evaluation of LLMs such as ChatGPT and the LLaMA series. Our analysis reveals how topic distribution and web resource availability influence hallucination frequency, uncovering language-specific biases that impact model accuracy. By offering a multilingual benchmark for fact verification, Poly-FEVER facilitates cross-linguistic comparisons of hallucination detection and contributes to the development of more reliable, language-inclusive AI systems. The dataset is publicly available to advance research in responsible AI, fact-checking methodologies, and multilingual NLP, promoting greater transparency and robustness in LLM performance. The proposed Poly-FEVER is available at: this https URL.",cs.CL,19/03/2025
2503.16537,Do Multimodal Large Language Models Understand Welding?,"Grigorii Khvatskii, Yong Suk Lee, Corey Angst, Maria Gibbs, Robert Landers, Nitesh V. Chawla","This paper examines the performance of Multimodal LLMs (MLLMs) in skilled production work, with a focus on welding. Using a novel data set of real-world and online weld images, annotated by a domain expert, we evaluate the performance of two state-of-the-art MLLMs in assessing weld acceptability across three contexts: RV \& Marine, Aeronautical, and Farming. While both models perform better on online images, likely due to prior exposure or memorization, they also perform relatively well on unseen, real-world weld images. Additionally, we introduce WeldPrompt, a prompting strategy that combines Chain-of-Thought generation with in-context learning to mitigate hallucinations and improve reasoning. WeldPrompt improves model recall in certain contexts but exhibits inconsistent performance across others. These results underscore the limitations and potentials of MLLMs in high-stakes technical domains and highlight the importance of fine-tuning, domain-specific data, and more sophisticated prompting strategies to improve model reliability. The study opens avenues for further research into multimodal learning in industry applications.",cs.CL,18/03/2025
2503.16536,Word2Minecraft: Generating 3D Game Levels through Large Language Models,"Shuo Huang, Muhammad Umair Nasir, Steven James, Julian Togelius","We present Word2Minecraft, a system that leverages large language models to generate playable game levels in Minecraft based on structured stories. The system transforms narrative elements-such as protagonist goals, antagonist challenges, and environmental settings-into game levels with both spatial and gameplay constraints. We introduce a flexible framework that allows for the customization of story complexity, enabling dynamic level generation. The system employs a scaling algorithm to maintain spatial consistency while adapting key game elements. We evaluate Word2Minecraft using both metric-based and human-based methods. Our results show that GPT-4-Turbo outperforms GPT-4o-Mini in most areas, including story coherence and objective enjoyment, while the latter excels in aesthetic appeal. We also demonstrate the system' s ability to generate levels with high map enjoyment, offering a promising step forward in the intersection of story generation and game design. We open-source the code at this https URL",cs.CL,18/03/2025
2503.16534,Gender and content bias in Large Language Models: a case study on Google Gemini 2.0 Flash Experimental,Roberto Balestri,"This study evaluates the biases in Gemini 2.0 Flash Experimental, a state-of-the-art large language model (LLM) developed by Google, focusing on content moderation and gender disparities. By comparing its performance to ChatGPT-4o, examined in a previous work of the author, the analysis highlights some differences in ethical moderation practices. Gemini 2.0 demonstrates reduced gender bias, notably with female-specific prompts achieving a substantial rise in acceptance rates compared to results obtained by ChatGPT-4o. It adopts a more permissive stance toward sexual content and maintains relatively high acceptance rates for violent prompts, including gender-specific cases. Despite these changes, whether they constitute an improvement is debatable. While gender bias has been reduced, this reduction comes at the cost of permitting more violent content toward both males and females, potentially normalizing violence rather than mitigating harm. Male-specific prompts still generally receive higher acceptance rates than female-specific ones. These findings underscore the complexities of aligning AI systems with ethical standards, highlighting progress in reducing certain biases while raising concerns about the broader implications of the model's permissiveness. Ongoing refinements are essential to achieve moderation practices that ensure transparency, fairness, and inclusivity without amplifying harmful content.",cs.CL,18/03/2025
2503.16533,From Patient Consultations to Graphs: Leveraging LLMs for Patient Journey Knowledge Graph Construction,"Hassan S. Al Khatib, Sudip Mittal, Shahram Rahimi, Nina Marhamati, Sean Bozorgzad","The transition towards patient-centric healthcare necessitates a comprehensive understanding of patient journeys, which encompass all healthcare experiences and interactions across the care spectrum. Existing healthcare data systems are often fragmented and lack a holistic representation of patient trajectories, creating challenges for coordinated care and personalized interventions. Patient Journey Knowledge Graphs (PJKGs) represent a novel approach to addressing the challenge of fragmented healthcare data by integrating diverse patient information into a unified, structured representation. This paper presents a methodology for constructing PJKGs using Large Language Models (LLMs) to process and structure both formal clinical documentation and unstructured patient-provider conversations. These graphs encapsulate temporal and causal relationships among clinical encounters, diagnoses, treatments, and outcomes, enabling advanced temporal reasoning and personalized care insights. The research evaluates four different LLMs, such as Claude 3.5, Mistral, Llama 3.1, and Chatgpt4o, in their ability to generate accurate and computationally efficient knowledge graphs. Results demonstrate that while all models achieved perfect structural compliance, they exhibited variations in medical entity processing and computational efficiency. The paper concludes by identifying key challenges and future research directions. This work contributes to advancing patient-centric healthcare through the development of comprehensive, actionable knowledge graphs that support improved care coordination and outcome prediction.",cs.CL,18/03/2025
2503.16531,EEG-CLIP : Learning EEG representations from natural language descriptions,"Tidiane Camaret N'dir, Robin Tibor Schirrmeister","Deep networks for electroencephalogram (EEG) decoding are currently often trained to only solve a specific task like pathology or gender decoding. A more general approach leveraging the medical reports of clinical EEG recordings is to learn mappings between medical reports and EEG recordings. This approach was pioneered in the computer vision domain matching images and their text captions and subsequently allowed to do successful zero-shot decoding using textual class prompts. In this work, we follow this approach and develop a contrastive learning framework EEG-CLIP that aligns EEG time series and their corresponding clinical text descriptions in a shared embedding space. We investigate its potential for versatile EEG decoding, assessing performance on a range of few-shot and zero-shot settings. Overall, results show that EEG-CLIP manages to nontrivially align text and EEG representations. Our work presents a promising approach to learn general EEG representations, which could enable easier analyses of diverse decoding questions through zero shot decoding or training task-specific models from fewer training examples. The code for reproducing our results is available at this https URL.",cs.CL,18/03/2025
2503.16530,Enhancing LLM Generation with Knowledge Hypergraph for Evidence-Based Medicine,"Chengfeng Dou, Ying Zhang, Zhi Jin, Wenpin Jiao, Haiyan Zhao, Yongqiang Zhao, Zhengwei Tao","Evidence-based medicine (EBM) plays a crucial role in the application of large language models (LLMs) in healthcare, as it provides reliable support for medical decision-making processes. Although it benefits from current retrieval-augmented generation~(RAG) technologies, it still faces two significant challenges: the collection of dispersed evidence and the efficient organization of this evidence to support the complex queries necessary for EBM. To tackle these issues, we propose using LLMs to gather scattered evidence from multiple sources and present a knowledge hypergraph-based evidence management model to integrate these evidence while capturing intricate relationships. Furthermore, to better support complex queries, we have developed an Importance-Driven Evidence Prioritization (IDEP) algorithm that utilizes the LLM to generate multiple evidence features, each with an associated importance score, which are then used to rank the evidence and produce the final retrieval results. Experimental results from six datasets demonstrate that our approach outperforms existing RAG techniques in application domains of interest to EBM, such as medical quizzing, hallucination detection, and decision support. Testsets and the constructed knowledge graph can be accessed at \href{this https URL}{this https URL}.",cs.CL,18/03/2025
2503.16529,Safety Evaluation and Enhancement of DeepSeek Models in Chinese Contexts,"Wenjing Zhang, Xuejiao Lei, Zhaoxiang Liu, Limin Han, Jiaojiao Zhao, Beibei Huang, Zhenhong Long, Junting Guo, Meijuan An, Rongjia Du, Ning Wang, Kai Wang, Shiguo Lian","DeepSeek-R1, renowned for its exceptional reasoning capabilities and open-source strategy, is significantly influencing the global artificial intelligence landscape. However, it exhibits notable safety shortcomings. Recent research conducted by Robust Intelligence, a subsidiary of Cisco, in collaboration with the University of Pennsylvania, revealed that DeepSeek-R1 achieves a 100\% attack success rate when processing harmful prompts. Furthermore, multiple security firms and research institutions have identified critical security vulnerabilities within the model. Although China Unicom has uncovered safety vulnerabilities of R1 in Chinese contexts, the safety capabilities of the remaining distilled models in the R1 series have not yet been comprehensively evaluated. To address this gap, this study utilizes the comprehensive Chinese safety benchmark CHiSafetyBench to conduct an in-depth safety evaluation of the DeepSeek-R1 series distilled models. The objective is to assess the safety capabilities of these models in Chinese contexts both before and after distillation, and to further elucidate the adverse effects of distillation on model safety. Building on these findings, we implement targeted safety enhancements for six distilled models. Evaluation results indicate that the enhanced models achieve significant improvements in safety while maintaining reasoning capabilities without notable degradation. We open-source the safety-enhanced models at this https URL to serve as a valuable resource for future research and optimization of DeepSeek models.",cs.CL,18/03/2025
2503.16528,HDLCoRe: A Training-Free Framework for Mitigating Hallucinations in LLM-Generated HDL,"Heng Ping, Shixuan Li, Peiyu Zhang, Anzhe Cheng, Shukai Duan, Nikos Kanakaris, Xiongye Xiao, Wei Yang, Shahin Nazarian, Andrei Irimia, Paul Bogdan","Recent advances in large language models (LLMs) have demonstrated remarkable capabilities in code generation tasks. However, when applied to hardware description languages (HDL), these models exhibit significant limitations due to data scarcity, resulting in hallucinations and incorrect code generation. To address these challenges, we propose HDLCoRe, a training-free framework that enhances LLMs' HDL generation capabilities through prompt engineering techniques and retrieval-augmented generation (RAG). Our approach consists of two main components: (1) an HDL-aware Chain-of-Thought (CoT) prompting technique with self-verification that classifies tasks by complexity and type, incorporates domain-specific knowledge, and guides LLMs through step-by-step self-simulation for error correction; and (2) a two-stage heterogeneous RAG system that addresses formatting inconsistencies through key component extraction and efficiently retrieves relevant HDL examples through sequential filtering and re-ranking. HDLCoRe eliminates the need for model fine-tuning while substantially improving LLMs' HDL generation capabilities. Experimental results demonstrate that our framework achieves superior performance on the RTLLM2.0 benchmark, significantly reducing hallucinations and improving both syntactic and functional correctness.",cs.CL,18/03/2025
2503.16527,LLM Generated Persona is a Promise with a Catch,"Ang Li, Haozhe Chen, Hongseok Namkoong, Tianyi Peng","The use of large language models (LLMs) to simulate human behavior has gained significant attention, particularly through personas that approximate individual characteristics. Persona-based simulations hold promise for transforming disciplines that rely on population-level feedback, including social science, economic analysis, marketing research, and business operations. Traditional methods to collect realistic persona data face significant challenges. They are prohibitively expensive and logistically challenging due to privacy constraints, and often fail to capture multi-dimensional attributes, particularly subjective qualities. Consequently, synthetic persona generation with LLMs offers a scalable, cost-effective alternative. However, current approaches rely on ad hoc and heuristic generation techniques that do not guarantee methodological rigor or simulation precision, resulting in systematic biases in downstream tasks. Through extensive large-scale experiments including presidential election forecasts and general opinion surveys of the U.S. population, we reveal that these biases can lead to significant deviations from real-world outcomes. Our findings underscore the need to develop a rigorous science of persona generation and outline the methodological innovations, organizational and institutional support, and empirical foundations required to enhance the reliability and scalability of LLM-driven persona simulations. To support further research and development in this area, we have open-sourced approximately one million generated personas, available for public access and analysis at this https URL.",cs.CL,18/03/2025
2503.16525,KVShare: Semantic-Aware Key-Value Cache Sharing for Efficient Large Language Model Inference,"Huan Yang, Renji Zhang, Deyu Zhang","This paper presents KVShare, a multi-user Key-Value (KV) Cache sharing technology based on semantic similarity, designed to enhance the inference efficiency of Large Language Models (LLMs) and Multimodal Large Language Models (MLLMs). Addressing the limitations of existing prefix caching (strict text prefix matching) and semantic caching (loss of response diversity), KVShare achieves fine-grained KV cache reuse through semantic alignment algorithms and differential editing operations. Experiments on real-world user conversation datasets demonstrate that KVShare improves KV cache hit rates by over 60%, while maintaining output quality comparable to full computation (no significant degradation in BLEU and Rouge-L metrics). This approach effectively reduces GPU resource consumption and is applicable to scenarios with repetitive queries, such as healthcare and education.",cs.CL,17/03/2025
2503.16523,Mind2: Mind-to-Mind Emotional Support System with Bidirectional Cognitive Discourse Analysis,"Shi Yin Hong, Uttamasha Oyshi, Quan Mai, Gibson Nkhata, Susan Gauch","Emotional support (ES) systems alleviate users' mental distress by generating strategic supportive dialogues based on diverse user situations. However, ES systems are limited in their ability to generate effective ES dialogues that include timely context and interpretability, hindering them from earning public trust. Driven by cognitive models, we propose Mind-to-Mind (Mind2), an ES framework that approaches interpretable ES context modeling for the ES dialogue generation task from a discourse analysis perspective. Specifically, we perform cognitive discourse analysis on ES dialogues according to our dynamic discourse context propagation window, which accommodates evolving context as the conversation between the ES system and user progresses. To enhance interpretability, Mind2 prioritizes details that reflect each speaker's belief about the other speaker with bidirectionality, integrating Theory-of-Mind, physiological expected utility, and cognitive rationality to extract cognitive knowledge from ES conversations. Experimental results support that Mind2 achieves competitive performance versus state-of-the-art ES systems while trained with only 10\% of the available training data.",cs.CL,17/03/2025
2503.16520,Not All Personas Are Worth It: Culture-Reflective Persona Data Augmentation,"Ji-Eun Han, Yoonseok Heo","Incorporating personas into conversational AI models is crucial for achieving authentic and engaging interactions. However, the cultural diversity and adaptability of existing persona datasets is often overlooked, reducing their efficacy in building culturally aware AI systems. To address this issue, we propose a two-step pipeline for generating culture-specific personas and introduce KoPersona, a dataset comprising 200,000 personas designed to capture Korean cultural values, behaviors, and social nuances. A comprehensive evaluation through various metrics validates the quality of KoPersona and its relevance to Korean culture. This work not only contributes to persona-based research, but also establishes a scalable approach for creating culturally relevant personas adaptable to various languages and cultural contexts.",cs.CL,17/03/2025
2503.16516,"Using LLMs for Automated Privacy Policy Analysis: Prompt Engineering, Fine-Tuning and Explainability","Yuxin Chen, Peng Tang, Weidong Qiu, Shujun Li","Privacy policies are widely used by digital services and often required for legal purposes. Many machine learning based classifiers have been developed to automate detection of different concepts in a given privacy policy, which can help facilitate other automated tasks such as producing a more reader-friendly summary and detecting legal compliance issues. Despite the successful applications of large language models (LLMs) to many NLP tasks in various domains, there is very little work studying the use of LLMs for automated privacy policy analysis, therefore, if and how LLMs can help automate privacy policy analysis remains under-explored. To fill this research gap, we conducted a comprehensive evaluation of LLM-based privacy policy concept classifiers, employing both prompt engineering and LoRA (low-rank adaptation) fine-tuning, on four state-of-the-art (SOTA) privacy policy corpora and taxonomies. Our experimental results demonstrated that combining prompt engineering and fine-tuning can make LLM-based classifiers outperform other SOTA methods, \emph{significantly} and \emph{consistently} across privacy policy corpora/taxonomies and concepts. Furthermore, we evaluated the explainability of the LLM-based classifiers using three metrics: completeness, logicality, and comprehensibility. For all three metrics, a score exceeding 91.1\% was observed in our evaluation, indicating that LLMs are not only useful to improve the classification performance, but also to enhance the explainability of detection results.",cs.CL,16/03/2025
2503.16515,Highlighting Case Studies in LLM Literature Review of Interdisciplinary System Science,"Lachlan McGinness, Peter Baumgartner","Large Language Models (LLMs) were used to assist four Commonwealth Scientific and Industrial Research Organisation (CSIRO) researchers to perform systematic literature reviews (SLR). We evaluate the performance of LLMs for SLR tasks in these case studies. In each, we explore the impact of changing parameters on the accuracy of LLM responses. The LLM was tasked with extracting evidence from chosen academic papers to answer specific research questions. We evaluate the models' performance in faithfully reproducing quotes from the literature and subject experts were asked to assess the model performance in answering the research questions. We developed a semantic text highlighting tool to facilitate expert review of LLM responses.
We found that state of the art LLMs were able to reproduce quotes from texts with greater than 95% accuracy and answer research questions with an accuracy of approximately 83%. We use two methods to determine the correctness of LLM responses; expert review and the cosine similarity of transformer embeddings of LLM and expert answers. The correlation between these methods ranged from 0.48 to 0.77, providing evidence that the latter is a valid metric for measuring semantic similarity.",cs.CL,16/03/2025
