DOI,Title,Authors,Abstract,Section,Date
2503.16509,Earthquake Response Analysis with AI,"Deep Patel, Panthadeep Bhattacharjee, Amit Reza, Priodyuti Pradhan","A timely and effective response is crucial to minimize damage and save lives during natural disasters like earthquakes. Microblogging platforms, particularly Twitter, have emerged as valuable real-time information sources for such events. This work explores the potential of leveraging Twitter data for earthquake response analysis. We develop a machine learning (ML) framework by incorporating natural language processing (NLP) techniques to extract and analyze relevant information from tweets posted during earthquake events. The approach primarily focuses on extracting location data from tweets to identify affected areas, generating severity maps, and utilizing WebGIS to display valuable information. The insights gained from this analysis can aid emergency responders, government agencies, humanitarian organizations, and NGOs in enhancing their disaster response strategies and facilitating more efficient resource allocation during earthquake events.",cs.CL,14/03/2025
2503.16505,Scalable Evaluation of Online Moderation Strategies via Synthetic Simulations,"Dimitris Tsirmpas, Ion Androutsopoulos, John Pavlopoulos","Despite the ever-growing importance of online moderation, there has been no large-scale study evaluating the effectiveness of alternative moderation strategies. This is largely due to the lack of appropriate datasets, and the difficulty of getting human discussants, moderators, and evaluators involved in multiple experiments. In this paper, we propose a methodology for leveraging synthetic experiments performed exclusively by Large Language Models (LLMs) to initially bypass the need for human participation in experiments involving online moderation. We evaluate six LLM moderation configurations; two currently used real-life moderation strategies (guidelines issued for human moderators for online moderation and real-life facilitation), two baseline strategies (guidelines elicited for LLM alignment work, and LLM moderation with minimal prompting) a baseline with no moderator at all, as well as our own proposed strategy inspired by a Reinforcement Learning (RL) formulation of the problem. We find that our own moderation strategy significantly outperforms established moderation guidelines, as well as out-of-the-box LLM moderation. We also find that smaller LLMs, with less intensive instruction-tuning, can create more varied discussions than larger models. In order to run these experiments, we create and release an efficient, purpose-built, open-source Python framework, dubbed ""SynDisco"" to easily simulate hundreds of discussions using LLM user-agents and moderators. Additionally, we release the Virtual Moderation Dataset (VMD), a large dataset of LLM-generated and LLM-annotated discussions, generated by three families of open-source LLMs accompanied by an exploratory analysis of the dataset.",cs.CL,13/03/2025
2503.16498,"Llms, Virtual Users, and Bias: Predicting Any Survey Question Without Human Data","Enzo Sinacola, Arnault Pachot, Thierry Petit","Large Language Models (LLMs) offer a promising alternative to traditional survey methods, potentially enhancing efficiency and reducing costs. In this study, we use LLMs to create virtual populations that answer survey questions, enabling us to predict outcomes comparable to human responses. We evaluate several LLMs-including GPT-4o, GPT-3.5, Claude 3.5-Sonnet, and versions of the Llama and Mistral models-comparing their performance to that of a traditional Random Forests algorithm using demographic data from the World Values Survey (WVS). LLMs demonstrate competitive performance overall, with the significant advantage of requiring no additional training data. However, they exhibit biases when predicting responses for certain religious and population groups, underperforming in these areas. On the other hand, Random Forests demonstrate stronger performance than LLMs when trained with sufficient data. We observe that removing censorship mechanisms from LLMs significantly improves predictive accuracy, particularly for underrepresented demographic segments where censored models struggle. These findings highlight the importance of addressing biases and reconsidering censorship approaches in LLMs to enhance their reliability and fairness in public opinion research.",cs.CL,11/03/2025
2503.16480,Human Preferences for Constructive Interactions in Language Model Alignment,"Yara Kyrychenko, Jon Roozenbeek, Brandon Davidson, Sander van der Linden, Ramit Debnath","As large language models (LLMs) enter the mainstream, aligning them to foster constructive dialogue rather than exacerbate societal divisions is critical. Using an individualized and multicultural alignment dataset of over 7,500 conversations of individuals from 74 countries engaging with 21 LLMs, we examined how linguistic attributes linked to constructive interactions are reflected in human preference data used for training AI. We found that users consistently preferred well-reasoned and nuanced responses while rejecting those high in personal storytelling. However, users who believed that AI should reflect their values tended to place less preference on reasoning in LLM responses and more on curiosity. Encouragingly, we observed that users could set the tone for how constructive their conversation would be, as LLMs mirrored linguistic attributes, including toxicity, in user queries.",cs.CL,05/03/2025
2503.16464,Human-Centered AI in Multidisciplinary Medical Discussions: Evaluating the Feasibility of a Chat-Based Approach to Case Assessment,"Shinnosuke Sawano, Satoshi Kodera","In this study, we investigate the feasibility of using a human-centered artificial intelligence (AI) chat platform where medical specialists collaboratively assess complex cases. As the target population for this platform, we focus on patients with cardiovascular diseases who are in a state of multimorbidity, that is, suffering from multiple chronic conditions. We evaluate simulated cases with multiple diseases using a chat application by collaborating with physicians to assess feasibility, efficiency gains through AI utilization, and the quantification of discussion content. We constructed simulated cases based on past case reports, medical errors reports and complex cases of cardiovascular diseases experienced by the physicians. The analysis of discussions across five simulated cases demonstrated a significant reduction in the time required for summarization using AI, with an average reduction of 79.98\%. Additionally, we examined hallucination rates in AI-generated summaries used in multidisciplinary medical discussions. The overall hallucination rate ranged from 1.01\% to 5.73\%, with an average of 3.62\%, whereas the harmful hallucination rate varied from 0.00\% to 2.09\%, with an average of 0.49\%. Furthermore, morphological analysis demonstrated that multidisciplinary assessments enabled a more complex and detailed representation of medical knowledge compared with single physician assessments. We examined structural differences between multidisciplinary and single physician assessments using centrality metrics derived from the knowledge graph. In this study, we demonstrated that AI-assisted summarization significantly reduced the time required for medical discussions while maintaining structured knowledge representation. These findings can support the feasibility of AI-assisted chat-based discussions as a human-centered approach to multidisciplinary medical decision-making.",cs.CL,26/02/2025
2503.16463,Improving Interactive Diagnostic Ability of a Large Language Model Agent Through Clinical Experience Learning,"Zhoujian Sun, Ziyi Liu, Cheng Luo, Jiebin Chu, Zhengxing Huang","Recent advances in large language models (LLMs) have shown promising results in medical diagnosis, with some studies indicating superior performance compared to human physicians in specific scenarios. However, the diagnostic capabilities of LLMs are often overestimated, as their performance significantly deteriorates in interactive diagnostic settings that require active information gathering. This study investigates the underlying mechanisms behind the performance degradation phenomenon and proposes a solution. We identified that the primary deficiency of LLMs lies in the initial diagnosis phase, particularly in information-gathering efficiency and initial diagnosis formation, rather than in the subsequent differential diagnosis phase. To address this limitation, we developed a plug-and-play method enhanced (PPME) LLM agent, leveraging over 3.5 million electronic medical records from Chinese and American healthcare facilities. Our approach integrates specialized models for initial disease diagnosis and inquiry into the history of the present illness, trained through supervised and reinforcement learning techniques. The experimental results indicate that the PPME LLM achieved over 30% improvement compared to baselines. The final diagnostic accuracy of the PPME LLM in interactive diagnostic scenarios approached levels comparable to those achieved using complete clinical data. These findings suggest a promising potential for developing autonomous diagnostic systems, although further validation studies are needed.",cs.CL,24/02/2025
2503.16457,Integrating Personality into Digital Humans: A Review of LLM-Driven Approaches for Virtual Reality,"Iago Alves Brito, Julia Soares Dollis, Fernanda Bufon Färber, Pedro Schindler Freire Brasil Ribeiro, Rafael Teixeira Sousa, Arlindo Rodrigues Galvão Filho","The integration of large language models (LLMs) into virtual reality (VR) environments has opened new pathways for creating more immersive and interactive digital humans. By leveraging the generative capabilities of LLMs alongside multimodal outputs such as facial expressions and gestures, virtual agents can simulate human-like personalities and emotions, fostering richer and more engaging user experiences. This paper provides a comprehensive review of methods for enabling digital humans to adopt nuanced personality traits, exploring approaches such as zero-shot, few-shot, and fine-tuning. Additionally, it highlights the challenges of integrating LLM-driven personality traits into VR, including computational demands, latency issues, and the lack of standardized evaluation frameworks for multimodal interactions. By addressing these gaps, this work lays a foundation for advancing applications in education, therapy, and gaming, while fostering interdisciplinary collaboration to redefine human-computer interaction in VR.",cs.CL,22/02/2025
2503.16433,The Application of MATEC (Multi-AI Agent Team Care) Framework in Sepsis Care,"Andrew Cho, Jason M. Woo, Brian Shi, Aishwaryaa Udeshi, Jonathan S. H. Woo","Under-resourced or rural hospitals have limited access to medical specialists and healthcare professionals, which can negatively impact patient outcomes in sepsis. To address this gap, we developed the MATEC (Multi-AI Agent Team Care) framework, which integrates a team of specialized AI agents for sepsis care. The sepsis AI agent team includes five doctor agents, four health professional agents, and a risk prediction model agent, with an additional 33 doctor agents available for consultations. Ten attending physicians at a teaching hospital evaluated this framework, spending approximately 40 minutes on the web-based MATEC application and participating in the 5-point Likert scale survey (rated from 1-unfavorable to 5-favorable). The physicians found the MATEC framework very useful (Median=4, P=0.01), and very accurate (Median=4, P<0.01). This pilot study demonstrates that a Multi-AI Agent Team Care framework (MATEC) can potentially be useful in assisting medical professionals, particularly in under-resourced hospital settings.",cs.CL,09/02/2025
2503.16432,Multimodal Transformer Models for Turn-taking Prediction: Effects on Conversational Dynamics of Human-Agent Interaction during Cooperative Gameplay,"Young-Ho Bae, Casey C. Bennett","This study investigates multimodal turn-taking prediction within human-agent interactions (HAI), particularly focusing on cooperative gaming environments. It comprises both model development and subsequent user study, aiming to refine our understanding and improve conversational dynamics in spoken dialogue systems (SDSs). For the modeling phase, we introduce a novel transformer-based deep learning (DL) model that simultaneously integrates multiple modalities - text, vision, audio, and contextual in-game data to predict turn-taking events in real-time. Our model employs a Crossmodal Transformer architecture to effectively fuse information from these diverse modalities, enabling more comprehensive turn-taking predictions. The model demonstrates superior performance compared to baseline models, achieving 87.3% accuracy and 83.0% macro F1 score. A human user study was then conducted to empirically evaluate the turn-taking DL model in an interactive scenario with a virtual avatar while playing the game ""Dont Starve Together"", comparing a control condition without turn-taking prediction (n=20) to an experimental condition with our model deployed (n=40). Both conditions included a mix of English and Korean speakers, since turn-taking cues are known to vary by culture. We then analyzed the interaction quality, examining aspects such as utterance counts, interruption frequency, and participant perceptions of the avatar. Results from the user study suggest that our multimodal turn-taking model not only enhances the fluidity and naturalness of human-agent conversations, but also maintains a balanced conversational dynamic without significantly altering dialogue frequency. The study provides in-depth insights into the influence of turn-taking abilities on user perceptions and interaction quality, underscoring the potential for more contextually adaptive and responsive conversational agents.",cs.CL,05/02/2025
2503.16428,XAttention: Block Sparse Attention with Antidiagonal Scoring,"Ruyi Xu, Guangxuan Xiao, Haofeng Huang, Junxian Guo, Song Han","Long-Context Transformer Models (LCTMs) are vital for real-world applications but suffer high computational costs due to attention's quadratic complexity. Block-sparse attention mitigates this by focusing computation on critical regions, yet existing methods struggle with balancing accuracy and efficiency due to costly block importance measurements. In this paper, we introduce XAttention, a plug-and-play framework that dramatically accelerates long-context inference in Transformers models using sparse attention. XAttention's key innovation is the insight that the sum of antidiagonal values (i.e., from the lower-left to upper-right) in the attention matrix provides a powerful proxy for block importance. This allows for precise identification and pruning of non-essential blocks, resulting in high sparsity and dramatically accelerated inference. Across comprehensive evaluations on demanding long-context benchmarks-including RULER and LongBench for language, VideoMME for video understanding, and VBench for video generation. XAttention achieves accuracy comparable to full attention while delivering substantial computational gains. We demonstrate up to 13.5x acceleration in attention computation. These results underscore XAttention's ability to unlock the practical potential of block sparse attention, paving the way for scalable and efficient deployment of LCTMs in real-world applications. Code is available at this https URL.",cs.CL,20/03/2025
2503.16419,Stop Overthinking: A Survey on Efficient Reasoning for Large Language Models,"Yang Sui, Yu-Neng Chuang, Guanchu Wang, Jiamu Zhang, Tianyi Zhang, Jiayi Yuan, Hongyi Liu, Andrew Wen, Shaochen (Henry)Zhong, Hanjie Chen, Xia Hu","Large Language Models (LLMs) have demonstrated remarkable capabilities in complex tasks. Recent advancements in Large Reasoning Models (LRMs), such as OpenAI o1 and DeepSeek-R1, have further improved performance in System-2 reasoning domains like mathematics and programming by harnessing supervised fine-tuning (SFT) and reinforcement learning (RL) techniques to enhance the Chain-of-Thought (CoT) reasoning. However, while longer CoT reasoning sequences improve performance, they also introduce significant computational overhead due to verbose and redundant outputs, known as the ""overthinking phenomenon"". In this paper, we provide the first structured survey to systematically investigate and explore the current progress toward achieving efficient reasoning in LLMs. Overall, relying on the inherent mechanism of LLMs, we categorize existing works into several key directions: (1) model-based efficient reasoning, which considers optimizing full-length reasoning models into more concise reasoning models or directly training efficient reasoning models; (2) reasoning output-based efficient reasoning, which aims to dynamically reduce reasoning steps and length during inference; (3) input prompts-based efficient reasoning, which seeks to enhance reasoning efficiency based on input prompt properties such as difficulty or length control. Additionally, we introduce the use of efficient data for training reasoning models, explore the reasoning capabilities of small language models, and discuss evaluation methods and benchmarking.",cs.CL,20/03/2025
2503.16356,CaKE: Circuit-aware Editing Enables Generalizable Knowledge Learners,"Yunzhi Yao, Jizhan Fang, Jia-Chen Gu, Ningyu Zhang, Shumin Deng, Huajun Chen, Nanyun Peng","Knowledge Editing (KE) enables the modification of outdated or incorrect information in large language models (LLMs). While existing KE methods can update isolated facts, they struggle to generalize these updates to multi-hop reasoning tasks that depend on the modified knowledge. Through an analysis of reasoning circuits -- the neural pathways LLMs use for knowledge-based inference, we observe that current layer-localized KE approaches, such as MEMIT and WISE, which edit only single or a few model layers, struggle to effectively incorporate updated information into these reasoning pathways. To address this limitation, we propose CaKE (Circuit-aware Knowledge Editing), a novel method that enables more effective integration of updated knowledge in LLMs. CaKE leverages strategically curated data, guided by our circuits-based analysis, that enforces the model to utilize the modified knowledge, stimulating the model to develop appropriate reasoning circuits for newly integrated knowledge. Experimental results show that CaKE enables more accurate and consistent use of updated knowledge across related reasoning tasks, leading to an average of 20% improvement in multi-hop reasoning accuracy on MQuAKE dataset compared to existing KE methods. We release the code and data in this https URL.",cs.CL,20/03/2025
2503.16334,LLM Braces: Straightening Out LLM Predictions with Relevant Sub-Updates,"Ying Shen, Lifu Huang","Recent findings reveal that much of the knowledge in a Transformer-based Large Language Model (LLM) is encoded in its feed-forward (FFN) layers, where each FNN layer can be interpreted as the summation of sub-updates, each corresponding to a weighted column vector from the FFN's value parameter matrix that often encodes human-interpretable concepts. In light of this, we hypothesize that model performance and behaviors can be further enhanced and controlled by modulating the contributions of these sub-updates based on their relevance to the input or target output style, and propose LLMBRACES, a novel and efficient method that computes relevance scores associated with value vectors in FFN layers and leverages these scores to dynamically adjust the contribution of sub-updates. By optimizing sub-update contributions, LLMBRACES refines the prediction process, leading to more accurate and reliable outputs, much like a 'brace' providing support and stability. Moreover, LLMBRACES can be extended to support conditional control over generation characteristics, such as sentiment, thereby offering fine-grained steering of LLM outputs. Extensive experiments on various LLMs-including Qwen2.5-1.5B, Llama2-7B, and Llama3-8B-demonstrate that LLMBRACES outperforms baseline approaches in both fine-tuning and zero-shot settings while requiring significantly fewer tunable parameters, up to 75% fewer compared to LoRA. Furthermore, LLMBRACES excels in sentiment-controlled generation and toxicity reduction, highlighting its potential for flexible, controlled text generation across applications.",cs.CL,20/03/2025
2503.16252,Fin-R1: A Large Language Model for Financial Reasoning through Reinforcement Learning,"Zhaowei Liu, Xin Guo, Fangqi Lou, Lingfeng Zeng, Jinyi Niu, Zixuan Wang, Jiajie Xu, Weige Cai, Ziwei Yang, Xueqian Zhao, Chao Li, Sheng Xu, Dezhi Chen, Yun Chen, Zuo Bai, Liwen Zhang","Reasoning large language models are rapidly evolving across various domains. However, their capabilities in handling complex financial tasks still require in-depth exploration. In this paper, we introduce Fin-R1, a reasoning large language model specifically designed for the financial sector. Fin-R1 is built using a two-stage architecture, leveraging a financial reasoning dataset distilled and processed based on DeepSeek-R1. Through supervised fine-tuning (SFT) and reinforcement learning (RL) training, it demonstrates performance close to DeepSeek-R1 with a parameter size of 7 billion across a range of financial reasoning tasks. It achieves the state-of-the-art (SOTA) in the FinQA and ConvFinQA tasks between those LLMs in our evaluation, surpassing larger models in other tasks as well. Fin-R1 showcases strong reasoning and decision-making capabilities, providing solutions to various problems encountered in the financial domain. Our code is available at this https URL.",cs.CL,00/00/0000
2503.16212,MathFusion: Enhancing Mathematic Problem-solving of LLM through Instruction Fusion,"Qizhi Pei, Lijun Wu, Zhuoshi Pan, Yu Li, Honglin Lin, Chenlin Ming, Xin Gao, Conghui He, Rui Yan","Large Language Models (LLMs) have shown impressive progress in mathematical reasoning. While data augmentation is promising to enhance mathematical problem-solving ability, current approaches are predominantly limited to instance-level modifications-such as rephrasing or generating syntactic variations-which fail to capture and leverage the intrinsic relational structures inherent in mathematical knowledge. Inspired by human learning processes, where mathematical proficiency develops through systematic exposure to interconnected concepts, we introduce MathFusion, a novel framework that enhances mathematical reasoning through cross-problem instruction synthesis. MathFusion implements this through three fusion strategies: (1) sequential fusion, which chains related problems to model solution dependencies; (2) parallel fusion, which combines analogous problems to reinforce conceptual understanding; and (3) conditional fusion, which creates context-aware selective problems to enhance reasoning flexibility. By applying these strategies, we generate a new dataset, \textbf{MathFusionQA}, followed by fine-tuning models (DeepSeekMath-7B, Mistral-7B, Llama3-8B) on it. Experimental results demonstrate that MathFusion achieves substantial improvements in mathematical reasoning while maintaining high data efficiency, boosting performance by 18.0 points in accuracy across diverse benchmarks while requiring only 45K additional synthetic instructions, representing a substantial improvement over traditional single-instruction approaches. Our datasets, models, and code are publicly available at this https URL.",cs.CL,20/03/2025
2503.16163,SpeCache: Speculative Key-Value Caching for Efficient Generation of LLMs,"Shibo Jie, Yehui Tang, Kai Han, Zhi-Hong Deng, Jing Han","Transformer-based large language models (LLMs) have already achieved remarkable results on long-text tasks, but the limited GPU memory (VRAM) resources struggle to accommodate the linearly growing demand for key-value (KV) cache as the sequence length increases, which has become a bottleneck for the application of LLMs on long sequences. Existing KV cache compression methods include eviction, merging, or quantization of the KV cache to reduce its size. However, compression results in irreversible information forgetting, potentially affecting the accuracy of subsequent decoding. In this paper, we propose SpeCache, which takes full advantage of the large and easily expandable CPU memory to offload the complete KV cache, and dynamically fetches KV pairs back in each decoding step based on their importance measured by low-bit KV cache copy in VRAM. To avoid inference latency caused by CPU-GPU communication, SpeCache speculatively predicts the KV pairs that the next token might attend to, allowing us to prefetch them before the next decoding step which enables parallelization of prefetching and computation. Experiments on LongBench and Needle-in-a-Haystack benchmarks verify that SpeCache effectively reduces VRAM usage while avoiding information forgetting for long sequences without re-training, even with a 10x high KV cache compression ratio.",cs.CL,20/03/2025
